{
  "contract_version": "0.1.0-frozen",
  "request_id": "TOOL_REQ_DEMO_001",
  "tool": "MACROTRACE",
  "thesis_id": "THESIS_DEMO_001",
  "question": "财政供给指标与10年期美债收益率之间是否存在稳定的条件关联？",
  "as_of_date": "2026-08-04",
  "requested_evidence_type": "ASSOCIATIONAL",
  "workflow_hint": "RATES_TRANSMISSION",
  "input_object_refs": [
    {
      "contract_version": "0.1.0-frozen",
      "object_id": "DATA_US_TREASURY_10Y",
      "version_id": "VER_DEMO_20260804",
      "object_type": "DATASET",
      "name": "10-year Treasury yield demo snapshot",
      "representation": "PARQUET",
      "schema_version": "1.0.0",
      "content_hash": "0000000000000000000000000000000000000000000000000000000000000000",
      "license_policy": "PUBLIC",
      "access_scope": "WORKSPACE:WS_DEMO",
      "content_uri": "objects/DATA_US_TREASURY_10Y/VER_DEMO_20260804/data.parquet",
      "as_of_date": "2026-08-04",
      "data_schema": {
        "time_key": "date",
        "entity_keys": [],
        "value_fields": [
          "ust10"
        ],
        "frequency": "D",
        "units": {
          "ust10": "percent"
        },
        "field_types": {
          "date": "date",
          "ust10": "float64"
        }
      },
      "lineage_refs": [
        "SRC_PUBLIC_DEMO"
      ],
      "metadata": {
        "fixture_only": true
      }
    }
  ],
  "falsifier_requirements": [
    "加入货币条件后关系明显消失",
    "替换供给定义后方向不稳定",
    "不同估计窗口下结果不稳健"
  ],
  "timeout_seconds": 180,
  "display_mode": "ACADEMIC",
  "metadata": {
    "fixture_only": true
  }
}
